,users,ratings,shorts,times
128,Cycble,5,"1、人心中的成见是一座大山，但我命由我不由天，是魔是仙，我是谁只有我自己说了算。

2、哪吒和熬丙的打斗，是魔丸和灵珠的左右互搏，更是善与恶的现身说法，人性本善本恶并不重要，重要的是你习得的教育是什么，你要成为什么样的人。

3、“今天是我的生日宴，你们谁都不准哭。”哭成狗了好吗。

4、东北天后夏岗丽本色出演的群演太好笑了，哈哈哈哈哈。

5、和“是他是他就是他”的小哪吒完全是两个故事了，不是毁三观，而是打开了封神榜新世界的大门，改编的太好了，这个夏天，绝对要爆爆爆啊。

6、想了好久这部电影的问题是什么，大概是改了哪咤自刎，割肉还母，削骨还父的悲剧内核。",2019-07-13
129,肖浑,4,技术优秀，部分细节精彩，但故事整体并没有打动我，外部堆砌了太多花里胡哨的元素，偏偏主角自身的成长变化不够，亲子和友谊两段重要关系竟然都是靠反反复复踢毽子传达，“哪吒闹海”成“哪吒为毽狂”了。,2019-07-28
130,邓安庆,4,很成熟很好看的作品啊。美术，制作，人物塑造我都很喜欢。,2019-07-21
131,小四川,2,皮相做的还不错，观感体验也还行，但是依然没有真正吸引人的内核。动漫最吸引人的东西恰恰缺席了。,2019-07-28
132,眠去,4,我命由人不由天，谁不会为之泪奔呢,2019-07-21
133,半夜植树,3,"1、制作是精良的，电影工业是有长进的，
2、剧本的内核是媚俗的。阉割了“削肉还母，剔骨还父”的反叛精神，替换成“父慈子孝”、”用爱挨雷劈“的”正能量叙事“。这样一来，哪吒已经不是哪吒，而是一位成功接受思想改造的优秀少先队员。
3、对白大多是用段子堆砌起来的，未免单薄。致敬星爷的那部分也略显刻意。
4、看来”空手接白刃“已成为李靖的默认技能。
5、李夫人管哪吒叫”吒儿“，置金吒、木吒于何地？应该管哪吒叫”哪儿“……
P.S. 温馨提示一下：最后一个彩蛋不必等。",2019-08-03
134,[已注销],2,戏说不是胡说,2019-07-24
135,壹安2,5,终于打破了《大圣》《白蛇》拘泥于“为国风而国风”的短板，硬件条件满足的情况下专注于塑造人物性格和“逆天改命”的全民情绪点，是近几年《封神》IP改编最满意的一次，《悟空传》请你过来看看人家是怎么拍的。另外哪吒身上看到了漩涡鸣人的影子，不知饺子导演是否也是《火影》迷呢？,2019-07-20
136,万万,3,中二你就好好中二吧，非得加那些低级笑料干吗呢,2019-07-22
137,木由,4,这件万龙甲啊，太沉重了。敖丙带着全体龙族的希望，义字当先就这样冲进天劫了，最后只剩一缕小烟魂。实名请求封神宇宙给我龙族一个好结局，别再虐了。个人感觉龙族副线比主线更出彩。加油啊，封神宇宙。,2019-08-07
138,千鸟欢喜天,2,特别难过，如果是普通的动画片做成这样，肯定给五星的了，可惜是哪吒。哪吒是非常罕见的反抗君权父权的古典题材，现在突然又变成歌颂父权（爸爸瞒着你做了XX实际是为了你好）的东西，彷佛心底的一颗明珠被挖出来打扮得花枝招展再放点屎屁尿去接客一样。我能明白当年悲壮震撼的哪吒脑海不可能再重制上映，即使上映了也会被父母投诉到死，只是。。。单纯很难过而已。,2019-08-05
139,滿神的異教徒,1,周星驰式幽默是将搞笑段子甚至金句穿插在它注定应该属于的地方，而不是那样毫无章法的堆砌和滥用，网络用语和段子的大量使用削弱了原本古代背景的合理性，是一种极其讨巧的心思，打着迎合大众的恶趣味来达到现象级作品的目的，忽视了一个作品应该有的那些基本要求，这是对自己和对观众双方的不负责。,2019-07-31
140,玩酷子弟,2,因为大家吹爆才去看的，动画技术值得肯定，但配音到剧情全程尴尬，二流子哪吒，泼妇哪吒妈，娘娘腔的大胡子村民，结巴申公豹（为营造“申公公”的笑点设定为结巴）一口川普的肥佬太乙真人，各种掏裤裆喝鼻涕玩得不亦乐乎，把屎尿屁当幽默，把瞎编当创新。 我需要看《哪吒闹海》来净化心灵了。,2019-07-30
141,大头绿豆,5,此评价代表一位刚陪一位沉迷西游记数月的五龄童看完电影的老父亲的感受。孩子笑得开心，为父老泪纵横。,2019-07-26
142,晚不安,3,又一部好设定、烂剧本的国漫典型，长板效应在暑期档再次戳中了观众痛点——《哪吒》的剧作缺陷和胜利曲线几乎和《大圣归来》如出一辙。讲的是逆天改命和打破成见，中式超级英雄的反叛内核总能和时代情绪呼应。把全副精力都放在视效和燃点上，可幽默感是尴尬且失效的，故事细节和转折也难以推敲，从而让亲情与友情的元素变得非常羸弱。回想这些年的国漫爆款，独树一帜的还数《大护法》。,2019-08-02
143,舫原,2,国漫的通病 就是不能好好讲一个故事,2019-07-20
144,严荼,5,"身份认同长久以来被父权社会描述成无病呻吟的小事，不成体统的歪道；从前的哪吒们，动仄削骨还父削肉还母，投胎再造是他们逃离家庭歧视和社会指摘重获自由的唯一方法；

如果明天，我们每个人都可能是被主流价值观霸凌的没有三头六臂的哪吒；那么今天，我们还要不要作嘲笑一切“怪物”的庸人，镇压一切“妖孽”的玲珑塔呢？",2019-07-24
145,Eureka A.O.,3,精致，也抓人，但观感微妙。迪士尼拍出这个可以给五星，中国人不行，中国人知道哪吒到底是怎么回事，不管怎么感人，哪吒能给爹学背书吗？,2019-07-20
146,渡边,3,优点是故事节奏和画面都算流畅吧，但技术上并未看到比《大圣》有什么进步，成熟的商业动画吧，影院里的小孩子都看得很开心。为讨好大众难免有些媚俗，屎尿屁网络用语，卖基中二燃加感恩父母？最遗憾的还是改掉哪吒的死法吧，如果没有剔骨还父割肉还母，那用哪吒这个形象有什么必要吗？请蛮吉回来不就好了？,2019-07-26
147,Morning,3,主角的戏写得很聪明，尤其做出来了哪吒和敖丙的关系，令人接受容易又不落俗套。但节奏是一大问题，不如本身的技术那样流畅。思想上要比大圣成熟，但没有大圣那样锋利，我个人不喜欢的是配音部分。题外话，我在漫威中看到了世界上那么多维护世界和平保持公共安全的各路超英，可是在中国的这样的动画里永远看到的都是反面的神仙，查无此人的元始天尊，阴险狡猾的申公豹，缺乏专业的太乙真人，玩忽职守的结界神，这些代表着上层的人总是要被塑造成这样的轻浮与标签化，也许一部分暗合了世人的想象，但真的并不真实生动。这个电影没有在任何一个其他的角色上做出真正丰满立体的设定，都是在一个维度里做得规范踏实，所以最后这个可怜天下父母心感人却不深刻。,2019-07-21
148,大奇特(Grinch),3,哪吒和敖丙，其实就是小鱼儿与花无缺。魔丸和灵珠算一体两面的双胞胎，不同成长环境造就了不同的性格，一个是恶人谷魔星，一个是移花宫传人。小鱼儿不恶，花无缺却被恶人迷了心智，最后被设计打个你死我活。 ,2019-07-30
149,喵老师2333,3,让人物智商下线来推动剧情是最低级的剧作方式。这个故事就是靠着犯蠢来推动剧情的，浪费了有趣的创意和设定。就算最后口号喊得再响亮也盖不住空洞的故事。导演说为了避免反派脸谱化做了很多设定，恰恰最大的反派陈塘百姓是最脸谱的，跟银河一个德行，群众就是恶的化身。,2019-07-23
150,王俊俊,5,主创有才华，陈词滥调的神话故事也能拍的圆润饱满，有血有肉；导演没审美，再多投资，再好的题材，再大牌的明星资源，拍出来也让人皱眉，只能靠着争议性，话题性哄骗观众的钱，然后安慰自己，赚到就是成功的。万马齐喑究可哀，中国一直不缺有才华有实力有心思的创作者，缺的是机会，是社会资源的不公平分配。,2019-07-20
151,樹,3,“作为新晋的国产动画旗手，我们希望新晋的黑马不止于利用好莱坞式的叙事方式来讲述东方神话，而是希望它可以在主题、在美学、在技术上有更加深入的开拓和探索，而不仅仅只是传达单一讯号——我们和好莱坞的差距，正越来越小。”,2019-07-27
152,河狸,5,《绝代双骄之冰与火之歌》,2019-07-21
153,MustardL,2,因为考虑到低龄观众而加入许多低俗的笑话和段子似乎又和其要探讨的主题不相符；反倒觉得认真拍能更好,2019-07-21
154,我对你的无语简直能沉默整个宇宙,3,技术上很成熟了但是…,2019-07-27
155,qw0aszx,3,段子少点就好了,2019-07-28
156,好姑娘老妖,3,"哪吒是部很好的电影，
但是我看过更好的哪吒，
新版的差不多改编了整个故事，
从前的哪吒，反抗的是父权，是统治阶级，是所谓的优越感的天界权威。
现在的想哪吒，反抗的是虚幻的命运。
啥意思呢，就是好好听话，别折腾，你是谁，你有什么身份，都是天命所定。
真是非常主旋律的一部电影了。
所以我更喜欢那个自杀的哪吒，那个削骨还父，削肉还母的哪吒。
但是电影是不错的，推荐去看。",2019-07-23
157,德卡的羊,4,75/100，确实是惊艳！技术上是绝对的国漫新巅峰。完全建立于现代语境，用相当戏谑大胆的颠覆与重构，情节与人物焕然一新，让经典传说重现光辉。虽然内在主题“成见”和做自己之类的很俗套了，但所幸讲述的足够有趣。最厉害的是依旧无人逃的出这宿命魔掌，妖还是人都不行，最深处依旧足够悲壮。笑点够好笑，同时还能赚到我的眼泪。唯一问题是人物转折的铺垫还不够充分，有些突然，但跟惊艳的整体比，属于小问题了。,2019-07-16
158,维舟,4,3星半。技术和以前比真可说上了个台阶，但故事从叙事、结构、细节、笑料到价值观，可吐槽的地方太多。场面明显向好莱坞看齐，不少角色设置脸谱化，后面的情节转折也有点不自然。这个版本的哪吒，冲突已不是在传统的“人伦”与“天命”之间展开，相反，变成了游离出来的个人对命运的抗争，所谓“我命由我不由天”，但实际上这种抗争的成败，却依靠暴力。哪吒痛苦的来源和仇恨的矛头所指，与其说是作为恶人的申公豹，倒不如说是人群的偏见——他们被笼统地视为愚氓。这个哪吒，其实是弗兰肯斯坦的怪物，只不过在中国的叙事里，心即天理，他可以不惮对抗而将自己正当化。,2019-10-15
159,paobecky,3,没有稳定的三观，没有逻辑，没有文化输出，少儿不宜。,2019-07-20
160,易老邪,2,看前半部感觉不够好，看后半部感觉非常烂。相比《哪吒闹海》，本片的故事和人物都显平庸空洞、无聊乏味，而且到后面还都崩坏了。,2019-08-13
161,阿巴厮,4,再一次警告中国电影人，不准这样做电影了！不然还得花电影票钱！不可以！要坚持做烂片，不要又逼我花钱走进电影院！,2019-08-02
162,王写写,2,掂量许久，还是没法及格。CG技术越成熟，剧作匮乏越明显。悲情主线与搞笑段子严重割裂，徒有周星驰的壳，少了无厘头的魂，因为主角并非小人物。过于喜剧，稀释了众角色应有的个性。几乎每场戏都老了，但也确实勉强顺了下去。最大的要害，是对哪吒原形象DNA级的重造，在我看来不值一晒，本质是网络文化的思路，是肤浅幼稚的好莱坞化效仿。吸引眼球的伎俩全部是梦工厂式和网文式的，包括人物造型、动机、叙事曲线等。即便如此，自然也没能在此之上有什么革新。而原哪吒的反体制反父权性，铮铮傲骨，非常中国的戏曲气质，已完全替换为一套西方意识形态。某种程度上，哪吒形象比孙悟空更值得我们珍惜，因其具有更鲜明的历史对抗性和时代警示性。本片实质上已不能算改编，而是创造一个重名的新人物，完全迎合时代口味，就像剔除所有阴暗现实的格林童话。,2019-10-14
163,小伙队,4,在重庆的影院 人们随着太乙真人的四川普通话哈哈大笑  这样就很好啦   （当然我还是更喜欢经典版本的哪吒  那才是“我不连累你”和“不认命”的真正模样 在我心里 哪吒和大圣是比哈姆雷特还伟大的悲剧形象,2019-07-27
164,千寻亿选,3,千言万语汇成三个字：看不惯,2019-07-28
165,红豆?,5,敖丙好帅好苏啊……我对这种类型的男二简直无法抵抗……,2019-08-02
166,過期罐頭,3,网络段子对本片的伤害是巨大的，除此之外，这片到底想说啥呢。,2019-07-28
167,仲曰,4,熊孩子恐惧症患者慎入,2019-07-19
168,朝阳区妻夫木聪,4,戏说不是胡说，改编不是乱编。动作打斗行云流水一气呵成，技术层面也几乎无可挑剔，最主要的是这次的故事比之前的几部国产动漫都扎实了不少，没有糊弄观众。对权利的解构和重塑，阴阳善恶双生双克的设定，以及对“宿命论”的彻底颠覆，这跟《悟空传》里的空喊口号又不一样，笑点燃点都抛得恰到好处，对于人物性格和神态的塑造也十分得体且合乎情境。很乐于见到华语电影人/动画人对“封神”这个奇幻大IP下手，恭喜彩条屋终于硬气了一回。三星半，加半星鼓励。,2019-07-17
169,家庭医生李大毛,3,3星半吧。故事是全须全尾讲完了，燃的地方也能带动情绪，但为爹奋战真的不能接受……另外打完全村忽然单膝跪地嘿，这时候就很感谢复联4的导演把所有人朝着钢铁侠单膝跪地的一组镜头弃用了。,2019-07-29
170,托尼·王大拿,4,避重就轻间完成了从“父母皆祸害”到“历史进程靠个人奋斗”的温和改良，将哪吒原有的玉石俱焚般的刚烈变成了更符合广泛受众的取向；广泛地吸取了欧美动画长片的剧作模式和无厘头的幽默节点设置，大量的小聪明聚合体。,2019-08-10
171,Ada??Wong????,4,还行吧，作为最后一批豆瓣观看了本片的观众，谈谈这部电影优点缺点，本电影最大的优点就是颠覆，颠覆以前所有神话故事和电视剧的人物形象，以前的国产剧讲究好人没理由的好，坏人没理由的坏，这部看完给我最大的感触是敖丙反而是全片最正常的人？一个有血有肉的高富帅，敖丙拿的不是小龙女的剧本吗？缺点也很明显，主角一家很欠揍，哪吒有点像戴着大金链的东北小混混，没脑子、喜欢讲义气、爱面子、别人说啥他信啥，一言不合就干架，自暴自弃的病秧子。而哪吒的父亲本片感觉非常的阴森诡异，表面上正人君子作风，实际一股搅屎棍的作用。太乙真人则成了猪八戒人设，总之猪八戒什么性格无缝对接就完事了，申公豹则成了屌丝逆袭遇到社会不公的悲情人物。我看完一度怀疑这部电影的真正主角是敖丙！另外的缺点是笑点太尴尬，求国产动画不要再追求屎尿屁了。,2019-09-07
172,张春[阿卡纳],5,十星！！！！都去看好吗！！！！！！（喊到破音！！！）,2019-07-21
173,Cosine 万一,5,太棒了??有智商 有逻辑 有意思 希望票房大爆！改编的颠覆又相当合理，冲突和感情都不平面，感觉很多部分有漫威的影子。,2019-07-14
174,艾晨,4,三星，前半段三星，后半段四星。,2019-07-21
175,隔壁家的桃太太,4,技术完美。但我觉得“哪吒”是一个“我不要”“还给你”的人物，而不是吒儿这样和解、回归、圆满的角色……,2019-07-23
176,草威,4,故事讲得很出彩，实现得也很好。但有一些对白好像刻意的降低了品质感，我觉得不必要。总之加油。,2019-07-27
177,亲爱的桂花树,4,"三星剧情，五星的制作。四星平均。
我非常非常反感最后一幕所有百姓跪在地上的情节，让我想起美恐 cult那一部，制造恐怖，然后制服它，大众归顺与你。
比美恐更甚的是，这一部居然大众还下跪了。服了。
",2019-08-27
178,嗔,1,看到友邻都那么包容 我都怀疑人生了  太恶俗了 还不如大鱼海棠呢   真的恶俗到方方面面,2019-07-28
179,文森特九六,3,咱也不敢说，咱也不敢问,2019-08-01
180,每日可爱二百人,4,好看，技术过关。但可以挖掘的深度没挖够，哪吒有点浅，同样要承受孤独与命运不公的敖丙也刻画得有点浅。而且太像是日本或者美国（更像美国）电影了，跟《功夫熊猫》或《花木兰》似的，中国元素只是点缀，而所有的国仇家恨悲剧宿命都化为了个人成长。个人成长没什么不好，只是看多了有点无聊。,2019-07-28
181,隔壁LEO在唱歌,3,犯了和陈凯歌版赵氏孤儿一个毛病，把原著里最激烈的人性冲突给剔除了。,2019-07-27
182,巴乌,2,我猜很多女性一定不喜欢这个形象，老少咸宜也谈不上，这哪吒的口儿也太脏了！哪吒他妈就是一大傻子，他爹就是二傻子，太乙就是三傻子，当传统内核被所谓的“好莱坞式亲情友情”消解了，也就不是中国的哪吒了。声音呈现非常廉价，全片毫无想象力，甚至怀疑自己在看真人电影。ps龙宫的设定不错。,2019-07-28
183,栞皁峣,3,故事完整流畅，表达OK。最大毛病可能就是一个经典悲剧形象，经得起反复挖掘的深度，被迪斯尼化了，阖家欢乐四个字，注定止步在少儿档与真善美。我觉得甚至可以从赛博朋克人体炼金改造角度的切入哪吒这个命题，更别提都被痛痒乐团拿来做俄狄浦斯反叛标签的经典形象了。适合暑期档父母带孩子一起去看。,2019-07-21
184,老公你说句话呀,5,"我一直觉得中国古代神话能称得上传奇的只有两个人物
一是猴子 一是哪吒
百世蕴灵育出只石猴 大闹天宫腾云驾雾
三年怀胎生了个哪吒 东海屠龙翻江倒海
可以说 除了这两人 没人再能当得起离经放纵四个字的
但称得上悲剧的 约摸也只有这两个
一个五行山下压五百年 揭了封印 戴上金箍无悲无喜 拜佛西天 唤孙悟空
一个削肉还母剔骨还父 塑了莲身 站上火轮无怨无恨 封神南门 号三太子
这尘世最擅长的事 大抵就是抹杀疏狂者的落拓 磨平豪纵者的傲骨 斩灭叛世者的孤妄
",2019-07-25
185,深邃,3,价值观表达处理不好，上限就在那儿了。,2019-07-31
186,梦魇马戏团,2,一，商业片要求轻松和笑点OK，但我们有没有资格要求幽默更加高级？二，原作作为古典文化中难得的对传统和父权的解构反讽之作，如此的现代「再解构」，难道不是把它「退回去」了？,2019-07-29
187,N记2005,4,三星半。“魔童”版哪吒与敖丙的共生关系，与酷儿叙事有着不少共通之处。能引导个体觉醒、认知自我的，很大程度上是同路人。哪吒与敖丙通过观照对方，才得以认清自己，明白“我命由我不由天”，魔丸灵珠的“善恶”属性并不能定义自己。但红蓝配色，以及两人“合二为一”的太极阴阳图，实在是过于强烈的暗示...这么看来，李靖在众人面前揭穿敖丙的真实身份，其实是给敖丙“出柜”咯？...暑假档票房的有力竞争者，值得一看的国产动画电影。（作者：紫薯）,2019-07-18
188,萨库拉,4,充满想象力的新编，剧作令人惊喜。看上美厂旧版的那一代孩子，和看新版长大的这一代孩子，都很幸福。因为国产动画不仅崛起，还开始甩国产真人片八百里。对比隔壁的《银河补习班》，希望良币能驱逐劣币。,2019-07-18
189,陈皮子安,3,远远比不上老版，哪吒闹海的个人主义对抗父权社会，反规训的摇滚精神消耗殆尽，取而代之的是集体主义认可和嬉皮笑脸，最可怕的是将哪吒本身充沛的生命激情变为了邪恶，又用家庭和集体相混淆的方式进行洗涤。最后变为了父爱无疆，友谊万岁与女权主义对个人自由和性情挥毫的压抑。可见四十年来价值观的惊人变化。,2019-07-31
190,某妮,4,自古红蓝出CP！虽然对“我命由我不由天”这种主题还蛮疲劳的~｜电审动字［2019］018号,2019-07-14
191,你看起来很好吃,3,国漫就剧情逻辑是硬伤啊，也不讲科学。,2019-07-21
192,静心阁亦疗伤,2,这个…怎么说就是可能更符合00后的审美，对老年人不太友好，对弱化的母子线有些遗憾。,2019-07-20
193,烤芬,2,四年后做出了个还不如大圣的大圣，这就没什么好尬吹的了吧。,2019-07-28
194,天蝎小猪,5,看哭了呀。。。期待“封神宇宙”（真的有吗？）,2019-07-25
195,喵咪戴戒指,4,不太喜欢这部戏里太乙真人的设定，低俗梗比谐音梗还要扣钱。打斗场面很加分，终于不是一个大招打赢boss的局了。只是那盘在一根根柱子上的龙，天庭怎么就这么理直气壮让他们数年如一日地在不见天日的地方镇压坏蛋啊，能不能轮个岗…,2019-07-22
196,K,2,小学作文式的文本。所有角色都是NPC。最喜欢的是干冰压城的想法。至于哪吒，有态度和情绪，但木有自己啊。,2019-07-29
197,周沐君,4,所以最后龙族怎么样了？,2019-08-11
198,fwb,3,我看哪吒，就是抱着观察代沟的角度去看的。因为票圈零星金句所代表的片子主题，不出我所料，一定会打动网络时代活在众人（庸众）普世价值观“无所不在凝视”之中、想要喘口气做回自己（有没有自己另说）的乖顺年轻人的心灵。片子把这个故事所蕴含的原本直刺中国传统文化中最隆重的父母与孩子关系的惨烈故事，柔化成了带入感极强、（小）中产、乖孩子主流心态的父母关系中，做自己，善战胜恶，父母、师傅为孩子奋不顾身………一部不错的主流商业片，为了支持国产动画片，我不后悔花钱买票进影院。对我来说最有趣的，是观察今天能说服年轻人的场景想象、像素精度，以及中国动画片如何在迪士尼和日漫夹击中慢慢摸索自己审美语言的那个过渡………,2019-08-01
199,本来老六,4,非常不错，但不如大圣归来。我更喜欢白蛇缘起,2019-07-20
200,XU,3,冥冥中有股党性...,2019-10-24
201,RUNE,3,泼个冷水，“哪吒”的模式其实还蛮网文的，穿插着各种不合时宜的现代烂俗梗，尤其是在各种隐藏“大战”（封神战）、“等级”、“技能”术语悄然而过的瞬间，就令我不止一次地回想起无数个躲在被窝里偷看网络小说的夜晚，可惜现在早已不是这种年纪。“哪吒”的技术固然是无可挑剔的，然而故事略中二，深度如爽文，人物看似反传统，但其实又套路得可怜，逆天改命这种写烂了的东西大家是看得太少吗？就不要去妄想什么暗黑神话颠覆改编了，一切都是为了服务“画面”二字。,2019-07-19
202,Laputa,4,很娴熟的商业片，反面人物的塑造也细腻丰满，很难得。鸡蛋里挑骨头：动作场面过多了些，看着累，周星驰式的悲情喜剧元素太老套，核心价值观延续大圣归来，略显简单生硬。,2019-07-28
203,摸三,3,抛却一切成见，心平气和观看本片，非常负责任地说一句，真的难看,2019-08-11
204,.L.,2,吹过头，完全没有以前那一部上美影《哪吒闹海》感人,2019-07-28
205,saintdump,4,3.5/5。很有意思，“改剧本”成为银幕内外双重的指涉，哪吒的典故被注入邪、丧、敏感的人格特质，对新的观众重塑新的神话偶像，类似漫威雷神之于索尔。有个时刻我认为要向父权开炮了，但没有，和白蛇一样，调转枪口，对准“愚民”的成见，权力是隐含在人情关系中的，是亲情和友情，成为赋予情节合法性的动力，真心为你，让“不认命”的燃，在中国式权力语境内，有了悲壮的内核。尽管有诸多超英片的影子，但高水准的制作（神笔马良式的奇观，还是运动主观镜头），让人感到年轻创作的商业野心，就能用网游画风做出A级效果，包括插科打诨和彩蛋。,2019-07-21
206,????,4,其实够不到四星，但它在完成度和视觉想象力的基础上相比之前几部高口碑国产动画都更有主题深度，但又有所顾忌，既不愿意一黑到底，也想不出情节做升华性的诠释，编不下去了就把最内核的价值冲突留到彩蛋里甩给下一部，结尾则利用共情过渡到主流价值完成和解。喜剧思维也过于低级。,2019-07-17
